index,published,keyword,domain,language,valid,title,description,url,image,archive,content,quote
6f69d18ce70a4ffe0976ceb72ddaba66,2025-11-02T21:41:45Z,'Erdbeben',www.stern.de,de,0,Land am Hindukusch: Wieder Erdbeben in Afghanistan,Kabul - In Afghanistan hat wieder die Erde gebebt. Nach Angaben der US-Erdbebenwarte USGS hatte das Erdbeben im Norden des Landes in einer Tiefe von 28,https://www.stern.de/panorama/land-am-hindukusch--wieder-erdbeben-in-afghanistan-36182714.html,https://image.stern.de/36182716/t/s4/v1/w1440/r1.7778/-/02--44gddzo7v6v12axs2048jpeg---0abf9fb484a31515.jpg,,"Kopiere den aktuellen Link
Zur Merkliste hinzufügen
In Afghanistan kommt die Erde nicht zur Ruhe. Nun hat es wieder ein Erdbeben gegeben die Folgen sind noch unklar.
In Afghanistan hat wieder die … [+421 chars]",
c4b13a0b2c92c624a36aba73eabef9af,2025-11-03T03:52:58Z,'Erdbeben',www.faz.net,de,0,"Stärke 6,3: Mehr als 20 Tote bei Erdbeben im Norden Afghanistans",Mehrere Hundert Menschen wurden verletzt. Das Taliban-Regime hat Soldaten in die Erdbebengebiete entsandt. Einen funktionierenden Katastrophenschutz gibt es nicht.,https://www.faz.net/aktuell/gesellschaft/ungluecke/mehr-als-20-tote-bei-erdbeben-im-norden-afghanistans-accg-110762081.html,https://media0.faz.net/ppmedia/w1200/aktuell/1005209559/1.10762708/facebook_teaser/bewohner-der-provinz-samangan.jpg.webp,,Bei einem Erd­beben im Norden ­Afghanistans sind in der Nacht zum Montag nach Angaben des Gesund­heits­ministeriums mehr als 20 Personen ums Leben gekommen und mehr als 320 Personen verletzt worden. … [+2008 chars],
88d4d89cafa64c6dae701ad9cbb0b2eb,2025-11-03T11:38:44Z,'Erdbeben',www.zeit.de,de,0,Katastrophe: Erdbeben erschüttert Afghanistan - Mehr als 20 Tote,Hier finden Sie Informationen zu dem Thema „Katastrophe“. Lesen Sie jetzt „Erdbeben erschüttert Afghanistan - Mehr als 20 Tote“.,https://www.zeit.de/news/2025-11/03/erdbeben-erschuettert-afghanistan-mehr-als-20-tote,https://img.zeit.de/news/2025-11/03/erdbeben-erschuettert-afghanistan-mehr-als-20-tote-image-group/wide__1300x731,,Bei einem schweren Erdbeben im Norden Afghanistans sind mindestens 27 Menschen ums Leben gekommen. Das meldete die staatliche Nachrichtenagentur Bachtar. Zudem seien 730 Menschen verletzt worden. Am … [+1710 chars],
05d715e52ea8c4742b55fe5ca581f9e6,2025-11-03T11:38:44Z,'Erdbeben Rettungskräfte',www.stern.de,de,0,Katastrophe: Erdbeben erschüttert Afghanistan - Mehr als 20 Tote,Kabul - Bei einem schweren Erdbeben im Norden Afghanistans sind mindestens 27 Menschen ums Leben gekommen. Das meldete die staatliche Nachrichtenagentur,https://www.stern.de/panorama/katastrophe--erdbeben-erschuettert-afghanistan---mehr-als-20-tote-36183964.html,https://image.stern.de/36183966/t/Fk/v1/w1440/r1.7778/-/03--atbalnooxpv4axs2048jpeg---9126ae70b5117156.jpg,,"Kopiere den aktuellen Link
Zur Merkliste hinzufügen
Nach dem schweren Erdbeben in Nordafghanistan steigt die Opferzahl weiter. Zudem kam es zu zahlreichen Schäden. Was ist bekannt?
Bei einem schwe… [+1854 chars]",
bea8fb6e1a7531c46e61c72ece9a611d,2025-11-03T11:40:04Z,'Erdbeben',www.tagesspiegel.de,de,0,Katastrophe: Erdbeben erschüttert Afghanistan - Mehr als 20 Tote,Nach dem schweren Erdbeben in Nordafghanistan steigt die Opferzahl weiter. Zudem kam es zu zahlreichen Schäden. Was ist bekannt?,https://www.tagesspiegel.de/gesellschaft/panorama/katastrophe-erdbeben-erschuttert-afghanistan-mehr-als-20-tote-14732747.html,https://www.tagesspiegel.de/images/14732744/alternates/BASE_16_9_W1400/1762170004000/erdbeben-in-afghanistan.jpeg,,Bei einem schweren Erdbeben im Norden Afghanistans sind mindestens 27 Menschen ums Leben gekommen. Das meldete die staatliche Nachrichtenagentur Bachtar. Zudem seien 730 Menschen verletzt worden. Am … [+1766 chars],
